{
  "id": "9d3a7c2e-4b5f-4e8a-9c6d-7f9b1d3e5a23",
  "title": "Hugging Face Transformers：AI 生态事实标准的模型框架持续演进",
  "source": "github_trending",
  "source_url": "https://github.com/huggingface/transformers",
  "summary": "Hugging Face 的 Transformers 库是机器学习领域事实上的标准框架，为文本、视觉、音频与多模态模型提供统一的训练与推理接口，覆盖数千个预训练模型，兼容 PyTorch 等主流后端。今日其在 GitHub Trending 上仍保持稳定热度增长，说明其在 AI 生态中的基础设施地位：无论是快速试用开源模型、微调还是部署，开发者都高度依赖这套统一 API。对该条目的价值判断应着眼于长期：Transformers 持续推动前沿模型的开源落地与社区复用，是构建 AI 应用的基石依赖；对其版本更新、新模型支持与性能优化的跟踪，对团队技术选型具有持续意义。本条目信息增量有限，但作为生态基线值得记录。",
  "highlights": [
    "提供文本、视觉、音频与多模态统一训练推理接口",
    "作为开源模型生态基础设施，持续推动前沿模型落地"
  ],
  "score": 7,
  "importance": "medium",
  "tags": [
    "LLM",
    "训练",
    "部署",
    "开源项目",
    "多模态"
  ],
  "status": "analyzed",
  "fetched_at": "2026-08-12T04:40:00Z",
  "analyzed_at": "2026-08-12T06:20:00Z",
  "meta": {
    "stars": 80
  }
}
