{
  "id": "9b3e5c7d-4f1a-4c8e-9a9f-2d4f6a8c0e23",
  "title": "Modular 发布 Mojo 1.0：面向 AI 计算的编程语言走向稳定",
  "source": "hacker_news",
  "source_url": "https://news.ycombinator.com/item?id=49261128",
  "summary": "Modular 正式发布面向 AI 计算的编程语言 Mojo 1.0。Mojo 将 Python 的易用性与 C 级别的性能结合，具备类似 Rust 的内存安全能力，通过 MLIR 统一面向 CPU、GPU 与各类加速器编程，旨在摆脱对 CUDA 等厂商绑定平台的依赖。1.0 版本标志着语言从快速演进转向长期稳定：Modular 承诺 1.x 阶段以增量演进为主，其标准库采用 Apache 2.0 许可，并计划年内开源编译器。该语言已被用于 Modular 自身商业基础设施（MAX 推理框架与 Modular Cloud），发布过程累计超过 1100 个合并 PR、近 200 名贡献者。对 AI 基础设施领域而言，Mojo 能否成为 AI 时代的系统级语言、与 Python 生态的兼容策略以及实际性能表现仍是社区讨论焦点，值得持续跟踪。",
  "highlights": [
    "结合 Python 易用性与 C 级性能，具备类 Rust 内存安全能力",
    "通过 MLIR 统一面向 CPU、GPU 与加速器，摆脱 CUDA 绑定",
    "标准库 Apache 2.0 开源，计划年内开源编译器"
  ],
  "score": 7,
  "importance": "medium",
  "tags": [
    "训练",
    "部署",
    "产品发布",
    "AI基础设施",
    "编程语言"
  ],
  "status": "analyzed",
  "fetched_at": "2026-08-12T04:40:00Z",
  "analyzed_at": "2026-08-12T06:20:00Z",
  "meta": {
    "points": 309,
    "comments": 140
  }
}
