{
  "id": "4a8d0f2c-4e6f-4b9d-8f4e-7c9e1a3b5j78",
  "title": "Anthropic 研究：从黎曼 zeta 函数等难题考察 Claude 数学能力边界",
  "source": "hacker_news",
  "source_url": "https://news.ycombinator.com/item?id=49247070",
  "summary": "Anthropic 研究团队发布关于 Claude 数学能力的研究，以黎曼 zeta 函数等难题为测试对象，分析大模型的数学推理边界。文章探讨了模型在符号计算、证明思路生成与直觉猜测上的表现，并反思“数学能力”的评测方式：单纯以正确率衡量可能掩盖模型在推理路径、试错策略与可解释性上的真实差异。研究者提出，面对超出训练分布的开放数学问题时，模型的表现能更真实地反映其泛化与推理能力。该研究为评估前沿模型推理能力提供了新视角，对数学、代码与科学推理类评测设计具有参考意义。它也再次印证了“评测本身正在成为研究重点”——随着模型能力提升，如何设计有区分度、能揭示推理过程的评测任务，将直接决定我们对模型能力的理解深度。",
  "highlights": [
    "以黎曼 zeta 函数等难题考察 Claude 数学推理边界",
    "反思“数学能力”评测方式，提出关注推理路径与泛化"
  ],
  "score": 6,
  "importance": "medium",
  "tags": [
    "推理",
    "评估",
    "LLM",
    "论文解读"
  ],
  "related_models": [
    "Claude"
  ],
  "status": "analyzed",
  "fetched_at": "2026-08-12T04:40:00Z",
  "analyzed_at": "2026-08-12T06:20:00Z",
  "meta": {
    "points": 263,
    "comments": 170
  }
}
