{
  "id": "c6d7e8f9-a0b1-4c2d-8e3f-4a5b6c7d8e9f",
  "title": "AI-For-Beginners：微软开源 AI 入门课程（12 周 24 课时）",
  "source": "github_trending",
  "source_url": "https://github.com/microsoft/AI-For-Beginners",
  "original_text": "AI for Beginners 是微软开源的 AI 入门课程：12 周 24 课时，面向零基础学习者，配套可执行 Jupyter Notebook、测验与实战 Lab。内容覆盖：第一部分 AI 导论（历史与现状）；第二部分符号 AI（知识表示与专家系统、本体、概念图）；第三部分神经网络入门（感知机、自建多层感知机框架、PyTorch/TensorFlow 框架与过拟合）；第四部分计算机视觉（OpenCV、卷积神经网络 CNN 与架构、预训练网络与迁移学习、自编码器与 VAE、GAN 与风格迁移、目标检测、语义分割 U-Net）；第五部分自然语言处理（文本表示 BoW/TF-IDF、Word2Vec/GloVe 词嵌入、语言建模与自训练嵌入、RNN、生成式 RNN、Transformer 与 BERT、命名实体识别、大语言模型与提示编程和 Few-Shot）；第六部分其他 AI 技术（遗传算法、深度强化学习、多智能体系统）；第七部分 AI 伦理与负责任 AI；另附多模态网络 CLIP/VQGAN 等扩展。每节课含预读材料、可执行 Notebook（PyTorch 与 TensorFlow 双版本）、部分 Lab 与 MS Learn 关联模块，并新增 Hello AI World、简单神经网络、图像分类、文本情感分析等零基础可运行示例。支持 50+ 语言翻译（GitHub Action 自动维护），含教师课程设置指南，可 sparse checkout 跳过翻译目录减小体积。作者 Dmitry Soshnikov，编辑器 Jen Looper。",
  "summary": "AI for Beginners 是微软官方开源的 AI 入门课程，以 12 周 24 课时的系统化设计面向零基础学习者，是全球最受欢迎的免费 AI 学习资源之一。课程编排从符号 AI（知识表示与专家系统）讲起，逐步进入神经网络与深度学习（感知机、多层感知机、过拟合），再分两条主线深入计算机视觉（CNN、迁移学习、自编码器/VAE、GAN、目标检测、U-Net 语义分割）与自然语言处理（词嵌入、RNN、Transformer/BERT、大语言模型与提示编程/Few-Shot），并覆盖遗传算法、深度强化学习、多智能体系统与 AI 伦理等主题，最后附多模态（CLIP/VQGAN）扩展。教学特色是“理论与动手并重”：每课包含预读材料、可执行的 Jupyter Notebook（PyTorch 与 TensorFlow 双框架版本）、随堂测验与实战 Lab，并配套 MS Learn 模块与零基础可运行的入门示例（Hello AI World、图像分类、文本情感分析等）。项目通过 GitHub Action 自动维护 50+ 语言翻译，并针对教育者提供课程设置指南。对 AI 领域而言，它承担着“降低 AI 学习门槛、扩大人才池”的基础设施角色，与 LLM/Agent 前沿项目形成互补，是教学与自学的优质参考资料。",
  "highlights": [
    "12 周 24 课时系统课程，覆盖视觉/NLP/强化学习/AI 伦理",
    "PyTorch + TensorFlow 双框架可执行 Notebook 与测验 Lab",
    "GitHub Action 自动维护 50+ 语言翻译"
  ],
  "score": 5,
  "tags": [
    "LLM",
    "计算机视觉",
    "多模态",
    "教程指南",
    "训练"
  ],
  "related_models": [
    "BERT",
    "Word2Vec",
    "CLIP"
  ],
  "importance": "medium",
  "status": "analyzed",
  "fetched_at": "2026-08-11T08:30:00Z",
  "analyzed_at": "2026-08-11T09:00:00Z",
  "meta": {
    "stars": 4028,
    "non_standard_tags": []
  }
}
