{
  "id": "0c4f6d8e-4a2b-4d9f-8b0a-3e5g7b9d1f34",
  "title": "Google 发文论证 Go 是 AI 辅助软件工程的理想语言",
  "source": "hacker_news",
  "source_url": "https://news.ycombinator.com/item?id=49261133",
  "summary": "Google 官方博客发文论证 Go 是 AI 辅助软件工程的理想语言，理由是 Go 的简洁语法、强类型系统与低上下文依赖使编码 Agent 更易生成正确代码。文章结合大量实例，分析语言特性如何影响 AI 生成代码的质量与可维护性：更少的语法歧义、显式的错误处理、以及对大型代码库的清晰结构约束，都有助于降低模型出错概率。该文引发关于“哪种语言最适合 AI 编程”的激烈辩论，支持者认为静态强类型语言减少幻觉与类型错误，质疑者则指出训练数据分布与工具链生态同样关键，Go 的“易生成”未必等于“易维护”。对团队而言，这是在编码 Agent 时代进行语言选型时值得纳入考量的视角，可与社区关于 token 效率的分析互为补充。",
  "highlights": [
    "论证简洁语法与强类型让 Agent 更易生成正确代码",
    "引发“哪种语言最适合 AI 编程”的社区激烈辩论"
  ],
  "score": 6,
  "importance": "medium",
  "tags": [
    "行业分析",
    "LLM",
    "编程语言",
    "技术博客",
    "工具调用"
  ],
  "status": "analyzed",
  "fetched_at": "2026-08-12T04:40:00Z",
  "analyzed_at": "2026-08-12T06:20:00Z",
  "meta": {
    "points": 296,
    "comments": 337
  }
}
