{
  "id": "4c8f0d6e-4a2b-4d9f-8b5a-7e9c1d3f5a78",
  "title": "安全研究：可从专有 LLM API 中窃取加密推理轨迹",
  "source": "hacker_news",
  "source_url": "https://news.ycombinator.com/item?id=49257876",
  "summary": "一项由 ELLIS 研究所图宾根与马普智能系统研究所等机构完成的 116 页安全研究揭示，Anthropic、OpenAI、Google 等主流闭源模型 API 返回给客户端的加密思维链（chain-of-thought）块并非真正安全：这些加密块可跨会话、跨用户、跨同厂商模型重放。攻击者只需将强模型（如 Claude Opus）的加密推理块注入同厂商更弱、防护更弱的模型（如 Claude Haiku），即可让后者逐字还原前者隐藏的推理过程，即“Haiku 可以读出 Opus 的思考”。研究团队从公开仓库解码了 31.5 万余个推理块，并演示了四类攻击向量：蒸馏专有推理轨迹、窃取凭据与隐私数据（发现 351 项泄露，含 PII 与凭据）、通过投毒推理块实施隐形提示注入、以及绕过对齐实现越狱。研究对推理模型服务商的加密设计、推理数据隐私与“思考过程保护”提出了严峻挑战，是近期 LLM 安全领域的重要发现。",
  "summary_en": "A 116-page security study from ELLIS Institute Tübingen and the Max Planck Institute shows that encrypted chain-of-thought blocks returned by proprietary LLM APIs from Anthropic, OpenAI, and Google are replayable across sessions, users, and models. By injecting a frontier model's encrypted reasoning block into a weaker, jailbroken sibling model from the same provider, attackers can recover the hidden reasoning verbatim — Haiku 4.5 can read Opus 4.8's thoughts. The team decoded over 315,000 blocks from public repositories and demonstrated four attack vectors: distillation of proprietary reasoning, extraction of credentials and PII, hidden prompt injection via poisoned blocks, and jailbreaking. This is a major finding for LLM security and reasoning-privacy protection.",
  "highlights": [
    "加密思维链块可跨会话、跨用户、跨同厂商模型重放",
    "用弱模型（Haiku）即可逐字还原强模型（Opus）的隐藏推理",
    "解码超 31 万推理块，演示蒸馏、窃密、注入、越狱四类攻击"
  ],
  "score": 9,
  "importance": "high",
  "tags": [
    "安全",
    "推理",
    "LLM",
    "论文解读"
  ],
  "related_models": [
    "Claude Opus",
    "Claude Haiku",
    "GPT",
    "Gemini"
  ],
  "status": "published",
  "fetched_at": "2026-08-12T04:40:00Z",
  "analyzed_at": "2026-08-12T06:20:00Z",
  "meta": {
    "points": 522,
    "comments": 214
  },
  "published_at": "2026-08-12T09:00:00Z",
  "distributed_to": [
    "telegram",
    "feishu"
  ]
}
