{
  "id": "8a2d4b6c-4e6f-4b9d-8f8e-1c3e5a7b9d12",
  "title": "OpenAI 伦理事务主管加入不足一年即离职，引发治理讨论",
  "source": "hacker_news",
  "source_url": "https://news.ycombinator.com/item?id=49257160",
  "summary": "据金融时报报道，OpenAI 伦理事务主管 Chloe Bakalar 在加入不到一年后离职。这一人事变动引发对 OpenAI 内部治理、AI 安全与伦理团队稳定性的广泛讨论。评论聚焦于：高速扩张期的 OpenAI 中伦理话语权是否被边缘化；企业在 AI 安全与负责任 AI 上的实际投入是否与其公开承诺匹配；以及行业整体在“负责任的 AI”建设上是否存在重宣传轻落地的现象。虽然单一高管离职不足以说明整体治理状况，但它与近期的安全团队动荡、模型发布节奏等议题叠加，使公众与开发者对 OpenAI 的长期治理透明度保持高度关注。对关注 AI 治理与行业生态的读者而言，本条属于需要持续跟踪的行业信号，信息增量有限但具有象征意义。",
  "highlights": [
    "OpenAI 伦理事务主管入职不足一年即离职",
    "引发对 AI 治理、伦理话语权与负责任 AI 实际投入的质疑"
  ],
  "score": 5,
  "importance": "medium",
  "tags": [
    "行业分析",
    "LLM",
    "OpenAI",
    "安全"
  ],
  "status": "analyzed",
  "fetched_at": "2026-08-12T04:40:00Z",
  "analyzed_at": "2026-08-12T06:20:00Z",
  "meta": {
    "points": 312,
    "comments": 354
  }
}
