{
  "id": "7b1e5a9c-4f3d-4c8e-9a4b-5d7f9b1c3e01",
  "title": "code-graph-rag：面向大型代码仓库的图增强 RAG 方案",
  "source": "github_trending",
  "source_url": "https://github.com/vitali87/code-graph-rag",
  "summary": "code-graph-rag 是一个面向大型代码仓库（如 monorepo）的 RAG 检索增强开源方案，结合知识图谱对多语言代码库进行查询、理解与编辑。传统 RAG 在代码场景中常因上下文割裂而效果不佳：代码的依赖关系、调用链与模块结构是高度图化的，而向量检索难以显式表达这些关系。该项目用图结构建模代码依赖关系，将函数、类、模块与调用关系纳入检索范围，从而提升 AI 对复杂工程的理解准确度，支持更可靠的代码问答与编辑。对从事代码智能、Repo 级 Agent 与 IDE 辅助工具的团队具有参考价值，是 RAG 与图技术结合在代码领域的具体实践；其图构建成本、增量更新机制与多语言支持仍需结合实际评估。",
  "highlights": [
    "以知识图谱建模代码依赖关系，缓解代码 RAG 上下文割裂",
    "面向 monorepo 多语言代码库提供查询、理解与编辑能力"
  ],
  "score": 6,
  "importance": "medium",
  "tags": [
    "RAG",
    "知识图谱",
    "开源项目",
    "代码智能"
  ],
  "status": "analyzed",
  "fetched_at": "2026-08-12T04:40:00Z",
  "analyzed_at": "2026-08-12T06:20:00Z",
  "meta": {
    "stars": 341
  }
}
