{
  "id": "1d5a7e9f-4b3c-4e8a-9c1b-4f6a8c0e2g45",
  "title": "技术博客：压缩即预测，从信息论理解大模型为何有效",
  "source": "hacker_news",
  "source_url": "https://news.ycombinator.com/item?id=49263497",
  "summary": "ngrok 技术博客以“压缩即预测”为题，阐述信息论与大模型预测本质之间的深层联系，从数据压缩的视角重新理解 LLM 的训练与生成原理。文章将 Kolmogorov 复杂度、预测编码与神经网络语言建模串成一条逻辑主线：预测下一个 token 本质上就是在压缩数据，压缩得越好，对数据内在结构的理解就越深；因此大模型的“智能”可以看作是对海量语料进行高效压缩的副产品。文章以通俗方式连接了多个理论概念，适合希望从理论层面理解“为什么大模型有效”的读者。其观点与学界对“语言模型即通用压缩器”的讨论一脉相承，有助于工程师跳出工程细节、建立对模型能力的直觉判断；作为理论科普文章，信息密度适中，不涉及具体实现。",
  "highlights": [
    "以信息论视角串联 Kolmogorov 复杂度、预测编码与语言建模",
    "论证“预测即压缩”，为理解大模型有效性提供理论框架"
  ],
  "score": 6,
  "importance": "medium",
  "tags": [
    "LLM",
    "推理",
    "技术博客",
    "理论"
  ],
  "status": "analyzed",
  "fetched_at": "2026-08-12T04:40:00Z",
  "analyzed_at": "2026-08-12T06:20:00Z",
  "meta": {
    "points": 289,
    "comments": 128
  }
}
