{
  "id": "6e0b2f8a-4c4d-4f9b-8d7c-9a1b3d5f7c90",
  "title": "antirez 开源 H3-metal：Apple Silicon 上的原生 MiniMax-H3 推理实现",
  "source": "hacker_news",
  "source_url": "https://news.ycombinator.com/item?id=49252179",
  "summary": "Redis 作者 Salvatore Sanfilippo（antirez）开源 H3-metal（h3.c），一个用 C 与 Metal 编写的 MiniMax-H3 原生推理引擎，面向 Apple Silicon（M3/M5 Max）优化，MIT 许可。MiniMax-H3 是约 330 亿参数的开放权重全模态生成模型，可完成文生视频、音画同步与图文音引用条件生成；官方仅有基于多卡 GPU 的推理方案，而该项目绕开重型 Python 框架，直接在 Mac 上以 Metal 内核实现端到端推理。在 M5 Max 上，快速四步路径可在约 3.5 秒生成 22 帧 512 分辨率视频，峰值物理内存约 40GB；项目还包含零拷贝权重映射、激活缓冲复用等内存与性能优化。它展示了在 Apple 芯片上运行大型生成模型的可行性，是继 llama.cpp 模式后视频生成本地化的又一标志性尝试，对本地多模态推理有直接参考价值。",
  "highlights": [
    "以纯 C+Metal 在 Apple Silicon 上端到端运行 MiniMax-H3 文生视频",
    "M5 Max 上四步路径约 3.5 秒生成 22 帧视频，峰值内存约 40GB",
    "MIT 开源，兼顾零拷贝映射与激活复用等内存优化"
  ],
  "score": 7,
  "importance": "medium",
  "tags": [
    "多模态",
    "部署",
    "开源项目",
    "视频生成",
    "推理"
  ],
  "related_models": [
    "MiniMax-H3"
  ],
  "status": "analyzed",
  "fetched_at": "2026-08-12T04:40:00Z",
  "analyzed_at": "2026-08-12T06:20:00Z",
  "meta": {
    "points": 428,
    "comments": 94
  }
}
