{
  "id": "2a6d8b4c-4e8f-4b9d-8f3a-5c7e9a1b3d56",
  "title": "AI 正在吞噬互联网，网络集体记忆面临消失危机",
  "source": "hacker_news",
  "source_url": "https://news.ycombinator.com/item?id=49250836",
  "summary": "这篇文章探讨 AI 大模型与新型搜索正在“吃掉”互联网，导致网络集体记忆消失。随着越来越多内容被 AI 摘要化消费，用户不再点击原始网页，网站流量与创作者收益持续下降，公开网页作为人类知识载体的可持续性受到质疑。文章讨论延伸至多个关键问题：AI 训练数据的来源与版权授权、内容创作者激励机制的失效、以及开放网络（open web）的未来。这是近期关于“AI 与网络生态”的重要思辨文章，与搜索引擎 AI 化改造、出版商与 AI 公司之间的授权诉讼等现实议题紧密相关。对从业者的启示是：当 AI 成为主要信息入口，内容生产、分发与消费的闭环正在被重构，技术与产品设计都需要考虑对开放生态的反馈与责任。",
  "highlights": [
    "指出 AI 摘要化消费导致网站流量与创作者收益持续下降",
    "引发对 AI 训练数据来源、内容授权与开放网络未来的讨论"
  ],
  "score": 7,
  "importance": "medium",
  "tags": [
    "行业分析",
    "LLM",
    "内容生态",
    "技术博客"
  ],
  "status": "analyzed",
  "fetched_at": "2026-08-12T04:40:00Z",
  "analyzed_at": "2026-08-12T06:20:00Z",
  "meta": {
    "points": 874,
    "comments": 880
  }
}
