{
  "id": "6a0d4f8b-4e2c-4b9d-8f3a-4c6e8a0d2f99",
  "title": "OpenMontage：号称全球首个开源的智能体视频制作系统",
  "source": "github_trending",
  "source_url": "https://github.com/calesthio/OpenMontage",
  "summary": "OpenMontage 自称全球首个开源的智能体视频制作系统，内置 12 条生产管线、100 余个工具以及 700 余个 Agent 技能与制作知识文件，可将 AI 编码助手转化为完整的视频生产工作室。项目把视频策划、脚本撰写、素材剪辑、合成渲染等环节拆解为 Agent 可编排的技能链，让编码 Agent 以多步骤工作流方式完成从创意到成片的制作过程。其创新点在于“以 Agent 技能驱动内容生产”的工程化探索：通过大量可复用的技能与知识文件，降低视频制作的专业门槛。适合探索“AI 智能体驱动内容生产”的团队参考；但生产级视频质量、管线稳定性与资源消耗仍需结合具体场景验证，属早期高潜力项目。",
  "highlights": [
    "内置 12 条生产管线、100+ 工具与 700+ Agent 技能",
    "将视频策划到合成拆解为 Agent 可编排的技能链"
  ],
  "score": 6,
  "importance": "medium",
  "tags": [
    "Agent",
    "多模态",
    "开源项目",
    "视频生成",
    "工具调用"
  ],
  "status": "analyzed",
  "fetched_at": "2026-08-12T04:40:00Z",
  "analyzed_at": "2026-08-12T06:20:00Z",
  "meta": {
    "stars": 458
  }
}
