{
  "id": "2e6c8b4a-4f1d-4e9c-8a3b-5c7d9e1f2a55",
  "title": "香港大学开源 DeepTutor：终身个性化 AI 辅导系统",
  "source": "github_trending",
  "source_url": "https://github.com/HKUDS/DeepTutor",
  "summary": "DeepTutor 是香港大学数据科学实验室（HKUDS）开源的终身个性化 AI 辅导系统，面向教育场景提供自适应教学体验。系统通过持续跟踪学习者的状态与历史表现，动态调整讲解方式、练习难度与知识覆盖，强调“终身学习”的陪伴式辅导：模型不仅回答问题，还会基于对学习者认知水平的建模提供个性化讲解与针对性练习。项目结合大模型能力实现教育场景的自适应教学，是 AI 教育赛道热度较高的开源实践之一。对关注教育科技、个性化学习与长期用户建模的团队有参考价值；其技术栈与数据管道设计也可作为构建长期记忆型 Agent 应用（如持续跟踪用户画像）的样例。项目仍需观察真实课堂场景下的效果验证与数据隐私处理。",
  "highlights": [
    "基于学习者状态持续建模，提供自适应讲解与练习",
    "强调终身陪伴式辅导体验，开源可自托管"
  ],
  "score": 6,
  "importance": "medium",
  "tags": [
    "Agent",
    "LLM",
    "开源项目",
    "AI教育"
  ],
  "status": "analyzed",
  "fetched_at": "2026-08-12T04:40:00Z",
  "analyzed_at": "2026-08-12T06:20:00Z",
  "meta": {
    "stars": 812
  }
}
